{
  "format": "chalk.lab",
  "manifestVersion": 1,
  "id": "org.chalk-format.examples.screw-gauge",
  "version": "1.0.0",
  "title": {
    "bn": "স্ক্রু গজ",
    "en": "Screw gauge"
  },
  "description": {
    "bn": "থিম্বল ঘুরিয়ে তারটি আটকাও, প্রধান ও বৃত্তাকার স্কেল পড়ে ব্যাস লেখো।",
    "en": "Turn the thimble onto the wire, read the main and circular scales, and enter the diameter."
  },
  "subject": "physics",
  "classes": [
    "9",
    "10"
  ],
  "tags": [
    "measurement",
    "least count",
    "screw gauge",
    "micrometer"
  ],
  "entry": "c1:d2qouiwvb7uk7lamo3ye6hpsom",
  "poster": "c1:fylmqzbkwsvx2owkq5kqo6th7q",
  "libraries": [
    {
      "specifier": "three",
      "version": "0.185.1",
      "asset": "c1:tnju7fmkkem7urwcj2quaiihxm"
    },
    {
      "specifier": "three/addons/controls/OrbitControls.js",
      "version": "0.185.1",
      "asset": "c1:nqdfnh3c3kmjnngrlj4erirjdm"
    }
  ],
  "capabilities": [
    "state",
    "progress"
  ],
  "size": {
    "width": 960,
    "height": 600,
    "minWidth": 480,
    "minHeight": 320
  },
  "params": {
    "type": "object",
    "properties": {
      "pitch": {
        "type": "number",
        "title": {
          "bn": "পিচ",
          "en": "Pitch"
        },
        "minimum": 0.25,
        "maximum": 1,
        "multipleOf": 0.25,
        "default": 0.5,
        "x-chalk-unit": "mm"
      },
      "divisions": {
        "type": "integer",
        "title": {
          "bn": "বৃত্তাকার স্কেলের ভাগ",
          "en": "Circular scale divisions"
        },
        "enum": [
          50,
          100
        ],
        "default": 50
      },
      "zeroError": {
        "type": "boolean",
        "title": {
          "bn": "শূন্য ত্রুটি আছে",
          "en": "With a zero error"
        },
        "default": false
      }
    }
  },
  "presets": [
    {
      "id": "zero-error",
      "title": {
        "bn": "শূন্য ত্রুটিসহ",
        "en": "With a zero error"
      },
      "params": {
        "zeroError": true
      }
    }
  ],
  "license": "Apache-2.0",
  "authors": [
    "Chalk format examples"
  ]
}
